{"$schema":"https://json-schema.org/draft/2020-12/schema","$id":"https://legal-content.codepackr.com/schemas/source.schema.json","title":"Legal Source","type":"object","required":["schemaVersion","entityType","id","version","status","title","jurisdiction","content","sources","updatedAt"],"properties":{"schemaVersion":{"type":"string"},"entityType":{"const":"source"},"id":{"type":"string"},"version":{"type":"integer","minimum":1},"status":{"type":"string"},"title":{"type":"string"},"jurisdiction":{"type":"string"},"content":{"type":"object","properties":{"sourceType":{"type":"string","enum":["primary","secondary","official","court","legislation","notification","academic","other"]},"url":{"type":"string","format":"uri"},"publisher":{"type":"string"},"citation":{"type":"string"},"accessedAt":{"type":"string","format":"date-time"},"verificationStatus":{"type":"string","enum":["unverified","reviewed","verified"]},"publicationDate":{"type":["string","null"],"format":"date"}},"additionalProperties":true},"sources":{"type":"array","items":{"type":"string"}},"updatedAt":{"type":"string","format":"date-time"}},"additionalProperties":false}