{
  "schemaVersion": "v1",
  "entityType": "source",
  "id": "source:india:india-fundamental-rights-practice",
  "version": 1,
  "status": "review",
  "title": "Indian Fundamental Rights practice (Part III)",
  "jurisdiction": "India",
  "content": {
    "sourceType": "official",
    "url": "https://www.indiacode.nic.in/",
    "publisher": "Government of India / Supreme Court of India",
    "citation": "Constitution of India Part III; leading Supreme Court authorities on Fundamental Rights",
    "accessedAt": "2026-10-01T07:45:00Z",
    "verificationStatus": "reviewed",
    "publicationDate": "1950-01-26"
  },
  "sources": [],
  "updatedAt": "2026-10-01T07:45:00Z"
}
